Title,Authors,Publication Name,Year,DOI,Citation Count,Keywords,Abstract,Subject Areas,Index Terms,Link
Evaluating differentially private machine learning in practice,Jayaraman B.,Proceedings of the 28th USENIX Security Symposium,2019,,340,,,[],,https://api.elsevier.com/content/abstract/scopus_id/85075941582
Prediction of higher-selectivity catalysts by computer-driven workflow and machine learning,Zahrt A.F.,Science,2019,10.1126/science.aau5631,340,,,[],,https://api.elsevier.com/content/abstract/scopus_id/85060179885
Plant disease detection using machine learning,Maniyath S.R.,"Proceedings - 2018 International Conference on Design Innovations for 3Cs Compute Communicate Control, ICDI3C 2018",2018,10.1109/ICDI3C.2018.00017,340,,,[],,https://api.elsevier.com/content/abstract/scopus_id/85053162344
"Smart cities with big data: Reference models, challenges, and considerations",Lim C.,Cities,2018,10.1016/j.cities.2018.04.011,340,,,[],,https://api.elsevier.com/content/abstract/scopus_id/85047406958
Artificial intelligence in fracture detection: transfer learning from deep convolutional neural networks,Kim D.H.,Clinical Radiology,2018,10.1016/j.crad.2017.11.015,340,,,[],,https://api.elsevier.com/content/abstract/scopus_id/85038394587
A robust ECC-Based provable secure authentication protocol with privacy preserving for industrial internet of things,Li X.,IEEE Transactions on Industrial Informatics,2018,10.1109/TII.2017.2773666,340,,,[],,https://api.elsevier.com/content/abstract/scopus_id/85035107040
Silk fibroin/hydroxyapatite composites for bone tissue engineering,Farokhi M.,Biotechnology Advances,2018,10.1016/j.biotechadv.2017.10.001,340,,,[],,https://api.elsevier.com/content/abstract/scopus_id/85031406707
Ultrabroadband and High-Detectivity Photodetector Based on WS<inf>2</inf>/Ge Heterojunction through Defect Engineering and Interface Passivation,Wu D.,ACS Nano,2021,10.1021/acsnano.1c02007,339,,,[],,https://api.elsevier.com/content/abstract/scopus_id/85108422606
Current and projected future economic burden of Parkinson’s disease in the U.S.,Yang W.,npj Parkinson's Disease,2020,10.1038/s41531-020-0117-1,339,,,[],,https://api.elsevier.com/content/abstract/scopus_id/85087918723
Innovation and Design in the Age of Artificial Intelligence,Verganti R.,Journal of Product Innovation Management,2020,10.1111/jpim.12523,339,,,[],,https://api.elsevier.com/content/abstract/scopus_id/85083781043
Review on forecasting of photovoltaic power generation based on machine learning and metaheuristic techniques,Akhter M.N.,IET Renewable Power Generation,2019,10.1049/iet-rpg.2018.5649,339,,,[],,https://api.elsevier.com/content/abstract/scopus_id/85065232583
Increasing impacts of land use on biodiversity and carbon sequestration driven by population and economic growth,Marques A.,Nature Ecology and Evolution,2019,10.1038/s41559-019-0824-3,339,,,[],,https://api.elsevier.com/content/abstract/scopus_id/85062471479
Machine learning in medicine: Addressing ethical challenges,Vayena E.,PLoS Medicine,2018,10.1371/journal.pmed.1002689,339,,,[],,https://api.elsevier.com/content/abstract/scopus_id/85056257275
Digital Twins in health care: Ethical implications of an emerging engineering paradigm,Bruynseels K.,Frontiers in Genetics,2018,10.3389/fgene.2018.00031,339,,,[],,https://api.elsevier.com/content/abstract/scopus_id/85042098524
"The Role of ChatGPT, Generative Language Models, and Artificial Intelligence in Medical Education: A Conversation With ChatGPT and a Call for Papers",Eysenbach G.,JMIR Medical Education,2023,10.2196/46885,338,,,[],,https://api.elsevier.com/content/abstract/scopus_id/85149920229
Artificial intelligence in marketing: Systematic review and future research direction,Verma S.,International Journal of Information Management Data Insights,2021,10.1016/j.jjimei.2020.100002,338,,,[],,https://api.elsevier.com/content/abstract/scopus_id/85110701073
"Impacts of COVID-19 pandemic on the global energy system and the shift progress to renewable energy: Opportunities, challenges, and policy implications",Hoang A.T.,Energy Policy,2021,10.1016/j.enpol.2021.112322,338,,,[],,https://api.elsevier.com/content/abstract/scopus_id/85105899219
A survey on deep learning methods for power load and renewable energy forecasting in smart microgrids,Aslam S.,Renewable and Sustainable Energy Reviews,2021,10.1016/j.rser.2021.110992,338,,,[],,https://api.elsevier.com/content/abstract/scopus_id/85103731096
Application of deep learning algorithms in geotechnical engineering: a short critical review,Zhang W.,Artificial Intelligence Review,2021,10.1007/s10462-021-09967-1,338,,,[],,https://api.elsevier.com/content/abstract/scopus_id/85100910523
Joint Computation and Communication Design for UAV-Assisted Mobile Edge Computing in IoT,Zhang T.,IEEE Transactions on Industrial Informatics,2020,10.1109/TII.2019.2948406,338,,,[],,https://api.elsevier.com/content/abstract/scopus_id/85083817421
Artificial intelligence and sustainable development,Goralski M.,International Journal of Management Education,2020,10.1016/j.ijme.2019.100330,338,,,[],,https://api.elsevier.com/content/abstract/scopus_id/85074135528
Machine learning at facebook: Understanding inference at the edge,Wu C.J.,"Proceedings - 25th IEEE International Symposium on High Performance Computer Architecture, HPCA 2019",2019,10.1109/HPCA.2019.00048,338,,,[],,https://api.elsevier.com/content/abstract/scopus_id/85064189318
"Artificial intelligence, machine learning and health systems",Panch T.,Journal of Global Health,2018,10.7189/jogh.08.020303,338,,,[],,https://api.elsevier.com/content/abstract/scopus_id/85056283706
AI-based pathology predicts origins for cancers of unknown primary,Lu M.Y.,Nature,2021,10.1038/s41586-021-03512-4,337,,,[],,https://api.elsevier.com/content/abstract/scopus_id/85105338602
Surface and Interface Engineering for Nanocellulosic Advanced Materials,Yang X.,Advanced Materials,2021,10.1002/adma.202002264,337,,,[],,https://api.elsevier.com/content/abstract/scopus_id/85090473758
Machine learning in cardiovascular medicine: Are we there yet?,Shameer K.,Heart,2018,10.1136/heartjnl-2017-311198,337,,,[],,https://api.elsevier.com/content/abstract/scopus_id/85047537837
"Bio-based plastics - A review of environmental, social and economic impact assessments",Spierling S.,Journal of Cleaner Production,2018,10.1016/j.jclepro.2018.03.014,337,,,[],,https://api.elsevier.com/content/abstract/scopus_id/85044627001
"Impact of Vaccines; Health, Economic and Social Perspectives",Rodrigues C.M.C.,Frontiers in Microbiology,2020,10.3389/fmicb.2020.01526,336,,,[],,https://api.elsevier.com/content/abstract/scopus_id/85088805118
A survey on access control in the age of internet of things,Qiu J.,IEEE Internet of Things Journal,2020,10.1109/JIOT.2020.2969326,336,,,[],,https://api.elsevier.com/content/abstract/scopus_id/85084331973
"Transformative effects of IoT, Blockchain and Artificial Intelligence on cloud computing: Evolution, vision, trends and open challenges",Gill S.S.,Internet of Things (Netherlands),2019,10.1016/j.iot.2019.100118,336,,,[],,https://api.elsevier.com/content/abstract/scopus_id/85083432980
Electronic Redistribution: Construction and Modulation of Interface Engineering on CoP for Enhancing Overall Water Splitting,Yang L.,Advanced Functional Materials,2020,10.1002/adfm.201909618,336,,,[],,https://api.elsevier.com/content/abstract/scopus_id/85079886709
Advances and challenges in electrochemical CO<inf>2</inf> reduction processes: An engineering and design perspective looking beyond new catalyst materials,Garg S.,Journal of Materials Chemistry A,2020,10.1039/c9ta13298h,336,,,[],,https://api.elsevier.com/content/abstract/scopus_id/85078657834
Comparative analysis of surface water quality prediction performance and identification of key water parameters using different machine learning models based on big data,Chen K.,Water Research,2020,10.1016/j.watres.2019.115454,336,,,[],,https://api.elsevier.com/content/abstract/scopus_id/85077322574
The what-if tool: Interactive probing of machine learning models,Wexler J.,IEEE Transactions on Visualization and Computer Graphics,2020,10.1109/TVCG.2019.2934619,336,,,[],,https://api.elsevier.com/content/abstract/scopus_id/85075759064
The role of renewable energy technological innovation on climate change: Empirical evidence from China,Lin B.,Science of the Total Environment,2019,10.1016/j.scitotenv.2018.12.449,336,,,[],,https://api.elsevier.com/content/abstract/scopus_id/85059598294
Viewpoint: When will ai exceed human performance? Evidence from ai experts,Grace K.,Journal of Artificial Intelligence Research,2018,10.1613/jair.1.11222,336,,,[],,https://api.elsevier.com/content/abstract/scopus_id/85052837104
Robotic manipulation and sensing of deformable objects in domestic and industrial applications: a survey,Sanchez J.,International Journal of Robotics Research,2018,10.1177/0278364918779698,336,,,[],,https://api.elsevier.com/content/abstract/scopus_id/85049035755
Canadian Association of Radiologists White Paper on Artificial Intelligence in Radiology,Tang A.,Canadian Association of Radiologists Journal,2018,10.1016/j.carj.2018.02.002,336,,,[],,https://api.elsevier.com/content/abstract/scopus_id/85045189457
Machine Learning for Healthcare: On the Verge of a Major Shift in Healthcare Epidemiology,Wiens J.,Clinical Infectious Diseases,2018,10.1093/cid/cix731,336,,,[],,https://api.elsevier.com/content/abstract/scopus_id/85040572144
A Multidisciplinary Survey and Framework for Design and Evaluation of Explainable AI Systems,Mohseni S.,ACM Transactions on Interactive Intelligent Systems,2021,10.1145/3387166,335,,,[],,https://api.elsevier.com/content/abstract/scopus_id/85139251634
"Environmental concern in the era of industrialization: Can financial development, renewable energy and natural resources alleviate some load?",Usman M.,Energy Policy,2022,10.1016/j.enpol.2022.112780,335,,,[],,https://api.elsevier.com/content/abstract/scopus_id/85122653703
Impact of industry 4.0 on environmental sustainability,Oláh J.,Sustainability (Switzerland),2020,10.3390/su12114674,335,,,[],,https://api.elsevier.com/content/abstract/scopus_id/85086326352
What is machine learning? A primer for the epidemiologist,Bi Q.,American Journal of Epidemiology,2019,10.1093/aje/kwz189,335,,,[],,https://api.elsevier.com/content/abstract/scopus_id/85080847753
Artificial intelligence and games,Yannakakis G.N.,Artificial Intelligence and Games,2018,10.1007/978-3-319-63519-4,335,,,[],,https://api.elsevier.com/content/abstract/scopus_id/85073042438
Machine Learning-Based Network Vulnerability Analysis of Industrial Internet of Things,Zolanvari M.,IEEE Internet of Things Journal,2019,10.1109/JIOT.2019.2912022,335,,,[],,https://api.elsevier.com/content/abstract/scopus_id/85070188457
Diagnostic outcomes of esophageal cancer by artificial intelligence using convolutional neural networks,Horie Y.,Gastrointestinal Endoscopy,2019,10.1016/j.gie.2018.07.037,335,,,[],,https://api.elsevier.com/content/abstract/scopus_id/85054156035
Biomacromolecules as carriers in drug delivery and tissue engineering,Zhang Y.,Acta Pharmaceutica Sinica B,2018,10.1016/j.apsb.2017.11.005,335,,,[],,https://api.elsevier.com/content/abstract/scopus_id/85037629259
Edge-IIoTset: A New Comprehensive Realistic Cyber Security Dataset of IoT and IIoT Applications for Centralized and Federated Learning,Ferrag M.A.,IEEE Access,2022,10.1109/ACCESS.2022.3165809,334,,,[],,https://api.elsevier.com/content/abstract/scopus_id/85128320958
Internet of Things and Big Data as enablers for business digitalization strategies,Sestino A.,Technovation,2020,10.1016/j.technovation.2020.102173,334,,,[],,https://api.elsevier.com/content/abstract/scopus_id/85089247106
Big-Data Science in Porous Materials: Materials Genomics and Machine Learning,Jablonka K.M.,Chemical Reviews,2020,10.1021/acs.chemrev.0c00004,334,,,[],,https://api.elsevier.com/content/abstract/scopus_id/85086712878
Machine learning based solutions for security of Internet of Things (IoT): A survey,Tahsien S.M.,Journal of Network and Computer Applications,2020,10.1016/j.jnca.2020.102630,334,,,[],,https://api.elsevier.com/content/abstract/scopus_id/85082999922
Engineering energy level of metal center: Ru single-atom site for efficient and durable oxygen reduction catalysis,Xiao M.,Journal of the American Chemical Society,2019,10.1021/jacs.9b09234,334,,,[],,https://api.elsevier.com/content/abstract/scopus_id/85076740737
A survey on control issues in renewable energy integration and microgrid,Badal F.R.,Protection and Control of Modern Power Systems,2019,10.1186/s41601-019-0122-8,334,,,[],,https://api.elsevier.com/content/abstract/scopus_id/85073694439
Clinical applications of machine learning in cardiovascular disease and its relevance to cardiac imaging,Al'Aref S.J.,European Heart Journal,2019,10.1093/eurheartj/ehy404,334,,,[],,https://api.elsevier.com/content/abstract/scopus_id/85068474187
"Vascular Tissue Engineering: Progress, Challenges, and Clinical Promise",Song H.H.G.,Cell Stem Cell,2018,10.1016/j.stem.2018.02.009,334,,,[],,https://api.elsevier.com/content/abstract/scopus_id/85042416868
Techno-economic assessment of low-temperature carbon dioxide electrolysis,Shin H.,Nature Sustainability,2021,10.1038/s41893-021-00739-x,333,,,[],,https://api.elsevier.com/content/abstract/scopus_id/85110093653
"A critical review on environmental impacts of renewable energy systems and mitigation strategies: Wind, hydro, biomass and geothermal",Sayed E.T.,Science of the Total Environment,2021,10.1016/j.scitotenv.2020.144505,333,,,[],,https://api.elsevier.com/content/abstract/scopus_id/85098946590
Engineering dendritic cell vaccines to improve cancer immunotherapy,Perez C.R.,Nature Communications,2019,10.1038/s41467-019-13368-y,333,,,[],,https://api.elsevier.com/content/abstract/scopus_id/85075718400
How renewable energy consumption lower global CO<inf>2</inf> emissions? Evidence from countries with different income levels,Dong K.,World Economy,2020,10.1111/twec.12898,333,,,[],,https://api.elsevier.com/content/abstract/scopus_id/85075441186
A new era: artificial intelligence and machine learning in prostate cancer,Goldenberg S.L.,Nature Reviews Urology,2019,10.1038/s41585-019-0193-3,333,,,[],,https://api.elsevier.com/content/abstract/scopus_id/85065975705
How AI can be a force for good,Taddeo M.,Science,2018,10.1126/science.aat5991,333,,,[],,https://api.elsevier.com/content/abstract/scopus_id/85052077966
"Modelling the dynamic linkages between eco-innovation, urbanization, economic growth and ecological footprints for G7 countries: Does financial globalization matter?",Ahmad M.,Sustainable Cities and Society,2021,10.1016/j.scs.2021.102881,332,,,[],,https://api.elsevier.com/content/abstract/scopus_id/85103642189
Economic policy uncertainty: A literature review,Al-Thaqeb S.A.,Journal of Economic Asymmetries,2019,10.1016/j.jeca.2019.e00133,332,,,[],,https://api.elsevier.com/content/abstract/scopus_id/85072394603
Membrane technology in renewable-energy-driven desalination,Ali A.,Renewable and Sustainable Energy Reviews,2018,10.1016/j.rser.2017.07.047,332,,,[],,https://api.elsevier.com/content/abstract/scopus_id/85024930848
"The environmental Kuznets curve, based on the economic complexity, and the pollution haven hypothesis in PIIGS countries",Balsalobre-Lorente D.,Renewable Energy,2022,10.1016/j.renene.2021.10.059,331,,,[],,https://api.elsevier.com/content/abstract/scopus_id/85119486814
Digital Transformation and Innovation Management: A Synthesis of Existing Research and an Agenda for Future Studies,Appio F.P.,Journal of Product Innovation Management,2021,10.1111/jpim.12562,331,,,[],,https://api.elsevier.com/content/abstract/scopus_id/85099756036
Seamless retrievals of chlorophyll-a from Sentinel-2 (MSI) and Sentinel-3 (OLCI) in inland and coastal waters: A machine-learning approach,Pahlevan N.,Remote Sensing of Environment,2020,10.1016/j.rse.2019.111604,331,,,[],,https://api.elsevier.com/content/abstract/scopus_id/85079058489
Artificial Intelligence for Clinical Trial Design,Harrer S.,Trends in Pharmacological Sciences,2019,10.1016/j.tips.2019.05.005,331,,,[],,https://api.elsevier.com/content/abstract/scopus_id/85069623216
"The impacts of economic growth, trade openness and technological progress on renewable energy use in organization for economic co-operation and development countries",Alam M.M.,Renewable Energy,2020,10.1016/j.renene.2019.06.054,331,,,[],,https://api.elsevier.com/content/abstract/scopus_id/85067810782
Titanium dioxide: From engineering to applications,Kang X.,Catalysts,2019,10.3390/catal9020191,331,,,[],,https://api.elsevier.com/content/abstract/scopus_id/85062819841
Adaptive Neural Network Tracking Control for Robotic Manipulators with Dead Zone,Zhou Q.,IEEE Transactions on Neural Networks and Learning Systems,2019,10.1109/TNNLS.2018.2869375,331,,,[],,https://api.elsevier.com/content/abstract/scopus_id/85055202420
The effect of economic policy uncertainty on investor information asymmetry and management disclosures,Nagar V.,Journal of Accounting and Economics,2019,10.1016/j.jacceco.2018.08.011,331,,,[],,https://api.elsevier.com/content/abstract/scopus_id/85052733263
Semisupervised Deep Reinforcement Learning in Support of IoT and Smart City Services,Mohammadi M.,IEEE Internet of Things Journal,2018,10.1109/JIOT.2017.2712560,331,,,[],,https://api.elsevier.com/content/abstract/scopus_id/85045442794
Engineering NiS/Ni<inf>2</inf>P Heterostructures for Efficient Electrocatalytic Water Splitting,Xiao X.,ACS Applied Materials and Interfaces,2018,10.1021/acsami.7b16430,331,,,[],,https://api.elsevier.com/content/abstract/scopus_id/85041928311
Design of Secure User Authenticated Key Management Protocol for Generic IoT Networks,Wazid M.,IEEE Internet of Things Journal,2018,10.1109/JIOT.2017.2780232,331,,,[],,https://api.elsevier.com/content/abstract/scopus_id/85038402404
"Artificial intelligence in disease diagnosis: a systematic literature review, synthesizing framework and future research agenda",Kumar Y.,Journal of Ambient Intelligence and Humanized Computing,2023,10.1007/s12652-021-03612-z,330,,,[],,https://api.elsevier.com/content/abstract/scopus_id/85122799958
Machine learning applications for building structural design and performance assessment: State-of-the-art review,Sun H.,Journal of Building Engineering,2021,10.1016/j.jobe.2020.101816,330,,,[],,https://api.elsevier.com/content/abstract/scopus_id/85092300806
"Assessment of Muscle Function and Physical Performance in Daily Clinical Practice: A position paper endorsed by the European Society for Clinical and Economic Aspects of Osteoporosis, Osteoarthritis and Musculoskeletal Diseases (ESCEO)",Beaudart C.,Calcified Tissue International,2019,10.1007/s00223-019-00545-w,330,,,[],,https://api.elsevier.com/content/abstract/scopus_id/85066412818
Design of an electric vehicle fast-charging station with integration of renewable energy and storage systems,Domínguez-Navarro J.A.,International Journal of Electrical Power and Energy Systems,2019,10.1016/j.ijepes.2018.08.001,330,,,[],,https://api.elsevier.com/content/abstract/scopus_id/85051486692
"Entrepreneurship, institutional economics, and economic growth: an ecosystem perspective",Acs Z.J.,Small Business Economics,2018,10.1007/s11187-018-0013-9,330,,,[],,https://api.elsevier.com/content/abstract/scopus_id/85050764266
Machine Learning and Neurosurgical Outcome Prediction: A Systematic Review,Senders J.T.,World Neurosurgery,2018,10.1016/j.wneu.2017.09.149,330,,,[],,https://api.elsevier.com/content/abstract/scopus_id/85032300240
Improving the accuracy of medical diagnosis with causal machine learning,Richens J.G.,Nature Communications,2020,10.1038/s41467-020-17419-7,329,,,[],,https://api.elsevier.com/content/abstract/scopus_id/85089359887
Artificial Intelligence in Healthcare: Review and Prediction Case Studies,Rong G.,Engineering,2020,10.1016/j.eng.2019.08.015,329,,,[],,https://api.elsevier.com/content/abstract/scopus_id/85078130756
An autonomous untethered fast soft robotic insect driven by low-voltage dielectric elastomer actuators,Ji X.,Science Robotics,2019,10.1126/scirobotics.aaz6451,329,,,[],,https://api.elsevier.com/content/abstract/scopus_id/85077808035
"Cardiovascular disease risk prediction using automated machine learning: A prospective study of 423,604 UK Biobank participants",Alaa A.M.,PLoS ONE,2019,10.1371/journal.pone.0213653,329,,,[],,https://api.elsevier.com/content/abstract/scopus_id/85065908050
Artificial intelligence for diabetes management and decision support: Literature review,Contreras I.,Journal of Medical Internet Research,2018,10.2196/10775,329,,,[],,https://api.elsevier.com/content/abstract/scopus_id/85053350082
The impact of economic growth on CO2 emissions in Azerbaijan,Mikayilov J.I.,Journal of Cleaner Production,2018,10.1016/j.jclepro.2018.06.269,329,,,[],,https://api.elsevier.com/content/abstract/scopus_id/85052614927
Approval of artificial intelligence and machine learning-based medical devices in the USA and Europe (2015–20): a comparative analysis,Muehlematter U.J.,The Lancet Digital Health,2021,10.1016/S2589-7500(20)30292-2,328,,,[],,https://api.elsevier.com/content/abstract/scopus_id/85101335351
Surface Engineering of Ambient-Air-Processed Cesium Lead Triiodide Layers for Efficient Solar Cells,Yoon S.M.,Joule,2021,10.1016/j.joule.2020.11.020,328,,,[],,https://api.elsevier.com/content/abstract/scopus_id/85098568066
Customer experiences in the age of artificial intelligence,Ameen N.,Computers in Human Behavior,2021,10.1016/j.chb.2020.106548,328,,,[],,https://api.elsevier.com/content/abstract/scopus_id/85090737455
Uncertainty models for stochastic optimization in renewable energy applications,Zakaria A.,Renewable Energy,2020,10.1016/j.renene.2019.07.081,328,,,[],,https://api.elsevier.com/content/abstract/scopus_id/85070731538
An intrusion detection system for connected vehicles in smart cities,Aloqaily M.,Ad Hoc Networks,2019,10.1016/j.adhoc.2019.02.001,328,,,[],,https://api.elsevier.com/content/abstract/scopus_id/85061081071
A novel cryptocurrency price trend forecasting model based on LightGBM,Sun X.,Finance Research Letters,2020,10.1016/j.frl.2018.12.032,328,,,[],,https://api.elsevier.com/content/abstract/scopus_id/85059572951
Sustainability of artisanal mining of cobalt in DR Congo,Banza Lubaba Nkulu C.,Nature Sustainability,2018,10.1038/s41893-018-0139-4,328,,,[],,https://api.elsevier.com/content/abstract/scopus_id/85053321648
Engineering d-p Orbital Hybridization in Single-Atom Metal-Embedded Three-Dimensional Electrodes for Li–S Batteries,Han Z.,Advanced Materials,2021,10.1002/adma.202105947,327,,,[],,https://api.elsevier.com/content/abstract/scopus_id/85115704939
Recent Advances in Heterostructure Engineering for Lithium–Sulfur Batteries,Huang S.,Advanced Energy Materials,2021,10.1002/aenm.202003689,327,,,[],,https://api.elsevier.com/content/abstract/scopus_id/85099739347
"Bridging the gap between ethics and practice: Guidelines for reliable, safe, and trustworthy human-centered AI systems",Shneiderman B.,ACM Transactions on Interactive Intelligent Systems,2020,10.1145/3419764,327,,,[],,https://api.elsevier.com/content/abstract/scopus_id/85096998670
"Linking economic globalization, economic growth, financial development, and ecological footprint: Evidence from symmetric and asymmetric ARDL",Ahmed Z.,Ecological Indicators,2021,10.1016/j.ecolind.2020.107060,327,,,[],,https://api.elsevier.com/content/abstract/scopus_id/85092611799
The moderating role of renewable and non-renewable energy in environment-income nexus for ASEAN countries: Evidence from Method of Moments Quantile Regression,Anwar A.,Renewable Energy,2021,10.1016/j.renene.2020.09.128,327,,,[],,https://api.elsevier.com/content/abstract/scopus_id/85092075519
Organizational Decision-Making Structures in the Age of Artificial Intelligence,Shrestha Y.R.,California Management Review,2019,10.1177/0008125619862257,327,,,[],,https://api.elsevier.com/content/abstract/scopus_id/85069042061
Literature review: Machine learning techniques applied to financial market prediction,Henrique B.M.,Expert Systems with Applications,2019,10.1016/j.eswa.2019.01.012,327,,,[],,https://api.elsevier.com/content/abstract/scopus_id/85060759648
Challenges and prospects of 3D micro-supercapacitors for powering the internet of things,Lethien C.,Energy and Environmental Science,2019,10.1039/c8ee02029a,327,,,[],,https://api.elsevier.com/content/abstract/scopus_id/85060307907
Oxygen Vacancy Engineering Promoted Photocatalytic Ammonia Synthesis on Ultrathin Two-Dimensional Bismuth Oxybromide Nanosheets,Xue X.,Nano Letters,2018,10.1021/acs.nanolett.8b03655,327,,,[],,https://api.elsevier.com/content/abstract/scopus_id/85055093748
Machine learning modeling of superconducting critical temperature,Stanev V.,npj Computational Materials,2018,10.1038/s41524-018-0085-8,327,,,[],,https://api.elsevier.com/content/abstract/scopus_id/85049343570
Engineering oxygen-containing and amino groups into two-dimensional atomically-thin porous polymeric carbon nitrogen for enhanced photocatalytic hydrogen production,Meng N.,Energy and Environmental Science,2018,10.1039/c7ee03592f,327,,,[],,https://api.elsevier.com/content/abstract/scopus_id/85044141128
"Machine Learning Testing: Survey, Landscapes and Horizons",Zhang J.M.,IEEE Transactions on Software Engineering,2022,10.1109/TSE.2019.2962027,326,,,[],,https://api.elsevier.com/content/abstract/scopus_id/85123224381
On the coronavirus (Covid-19) outbreak and the smart city network: Universal data sharing standards coupled with artificial intelligence (ai) to benefit urban health monitoring and management,Allam Z.,Healthcare (Switzerland),2020,10.3390/healthcare8010046,326,,,[],,https://api.elsevier.com/content/abstract/scopus_id/85104242987
