Title,Authors,Publication Name,Year,DOI,Citation Count,Keywords,Abstract,Subject Areas,Index Terms,Link
"State-of-the-art robotic grippers, grasping and control strategies, as well as their applications in agricultural robots: A review",Zhang B.,Computers and Electronics in Agriculture,2020,10.1016/j.compag.2020.105694,289,,,[],,https://api.elsevier.com/content/abstract/scopus_id/85089083486
Ten challenges in advancing machine learning technologies toward 6G,Kato N.,IEEE Wireless Communications,2020,10.1109/MWC.001.1900476,289,,,[],,https://api.elsevier.com/content/abstract/scopus_id/85082030830
On the Role of Age of Information in the Internet of Things,Abd-Elmagid M.A.,IEEE Communications Magazine,2019,10.1109/MCOM.001.1900041,289,,,[],,https://api.elsevier.com/content/abstract/scopus_id/85076671978
5G network-based Internet of Things for demand response in smart grid: A survey on application potential,Hui H.,Applied Energy,2020,10.1016/j.apenergy.2019.113972,289,,,[],,https://api.elsevier.com/content/abstract/scopus_id/85073992044
A review of the artificial intelligence methods in groundwater level modeling,Rajaee T.,Journal of Hydrology,2019,10.1016/j.jhydrol.2018.12.037,289,,,[],,https://api.elsevier.com/content/abstract/scopus_id/85062607865
The urban south and the predicament of global sustainability,Nagendra H.,Nature Sustainability,2018,10.1038/s41893-018-0101-5,289,,,[],,https://api.elsevier.com/content/abstract/scopus_id/85051823177
Optimized Fibril Network Morphology by Precise Side-Chain Engineering to Achieve High-Performance Bulk-Heterojunction Organic Solar Cells,Liu T.,Advanced Materials,2018,10.1002/adma.201707353,289,,,[],,https://api.elsevier.com/content/abstract/scopus_id/85047538812
Alchemical and structural distribution based representation for universal quantum machine learning,Faber F.A.,Journal of Chemical Physics,2018,10.1063/1.5020710,289,,,[],,https://api.elsevier.com/content/abstract/scopus_id/85044203666
"Generative AI and ChatGPT: Applications, challenges, and AI-human collaboration",Fui-Hoon Nah F.,Journal of Information Technology Case and Application Research,2023,10.1080/15228053.2023.2233814,288,,,[],,https://api.elsevier.com/content/abstract/scopus_id/85165259201
Open artificial intelligence platforms in nursing education: Tools for academic progress or abuse?,O'Connor S.,Nurse Education in Practice,2023,10.1016/j.nepr.2022.103537,288,,,[],,https://api.elsevier.com/content/abstract/scopus_id/85144463828
On evaluation metrics for medical applications of artificial intelligence,Hicks S.A.,Scientific Reports,2022,10.1038/s41598-022-09954-8,288,,,[],,https://api.elsevier.com/content/abstract/scopus_id/85127930043
Learning Agile Robotic Locomotion Skills by Imitating Animals,Peng X.B.,Robotics: Science and Systems,2020,10.15607/RSS.2020.XVI.064,288,,,[],,https://api.elsevier.com/content/abstract/scopus_id/85119501718
Substantial capabilities of robotics in enhancing industry 4.0 implementation,Javaid M.,Cognitive Robotics,2021,10.1016/j.cogr.2021.06.001,288,,,[],,https://api.elsevier.com/content/abstract/scopus_id/85118565187
Blockchain for the IoT and industrial IoT: A review,Wang Q.,Internet of Things (Netherlands),2020,10.1016/j.iot.2019.100081,288,,,[],,https://api.elsevier.com/content/abstract/scopus_id/85114988836
"Low-carbon production of iron and steel: Technology options, economic assessment, and policy",Fan Z.,Joule,2021,10.1016/j.joule.2021.02.018,288,,,[],,https://api.elsevier.com/content/abstract/scopus_id/85104462686
"Vision-based robotic grasping from object localization, object pose estimation to grasp estimation for parallel grippers: a review",Du G.,Artificial Intelligence Review,2021,10.1007/s10462-020-09888-5,288,,,[],,https://api.elsevier.com/content/abstract/scopus_id/85089594296
Sex and gender differences and biases in artificial intelligence for biomedicine and healthcare,Cirillo D.,npj Digital Medicine,2020,10.1038/s41746-020-0288-5,288,,,[],,https://api.elsevier.com/content/abstract/scopus_id/85088067860
How renewable energy consumption contribute to environmental quality? The role of education in OECD countries,Zafar M.W.,Journal of Cleaner Production,2020,10.1016/j.jclepro.2020.122149,288,,,[],,https://api.elsevier.com/content/abstract/scopus_id/85084956964
Piezoelectric smart biomaterials for bone and cartilage tissue engineering,Jacob J.,Inflammation and Regeneration,2018,10.1186/s41232-018-0059-8,288,,,[],,https://api.elsevier.com/content/abstract/scopus_id/85084920000
AI-Driven Tools for Coronavirus Outbreak: Need of Active Learning and Cross-Population Train/Test Models on Multitudinal/Multimodal Data,Santosh K.C.,Journal of Medical Systems,2020,10.1007/s10916-020-01562-1,288,,,[],,https://api.elsevier.com/content/abstract/scopus_id/85082143057
Making the black box more transparent: Understanding the physical implications of machine learning,McGovern A.,Bulletin of the American Meteorological Society,2019,10.1175/BAMS-D-18-0195.1,288,,,[],,https://api.elsevier.com/content/abstract/scopus_id/85076246426
"Engineering the Thermal Conductivity of Functional Phase-Change Materials for Heat Energy Conversion, Storage, and Utilization",Yuan K.,Advanced Functional Materials,2020,10.1002/adfm.201904228,288,,,[],,https://api.elsevier.com/content/abstract/scopus_id/85073941827
"The effects of energy prices, urbanization and economic growth on energy consumption per capita in 186 countries",Wang Q.,Journal of Cleaner Production,2019,10.1016/j.jclepro.2019.04.008,288,,,[],,https://api.elsevier.com/content/abstract/scopus_id/85064193394
"Radiomics in Brain Tumor: Image Assessment, Quantitative Feature Descriptors, and Machine-Learning Approaches",Zhou M.,American Journal of Neuroradiology,2018,10.3174/ajnr.A5391,288,,,[],,https://api.elsevier.com/content/abstract/scopus_id/85042155083
Artificial Intelligence for Remote Sensing Data Analysis: A review of challenges and opportunities,Zhang L.,IEEE Geoscience and Remote Sensing Magazine,2022,10.1109/MGRS.2022.3145854,287,,,[],,https://api.elsevier.com/content/abstract/scopus_id/85128599124
Best practices in machine learning for chemistry,Artrith N.,Nature Chemistry,2021,10.1038/s41557-021-00716-z,287,,,[],,https://api.elsevier.com/content/abstract/scopus_id/85107328134
Valence Engineering via In Situ Carbon Reduction on Octahedron Sites Mn<inf>3</inf>O<inf>4</inf> for Ultra-Long Cycle Life Aqueous Zn-Ion Battery,Tan Q.,Advanced Energy Materials,2020,10.1002/aenm.202001050,287,,,[],,https://api.elsevier.com/content/abstract/scopus_id/85089362720
Tools and strategies of systems metabolic engineering for the development of microbial cell factories for chemical production,Ko Y.S.,Chemical Society Reviews,2020,10.1039/d0cs00155d,287,,,[],,https://api.elsevier.com/content/abstract/scopus_id/85088496319
Spherical lignin particles: A review on their sustainability and applications,Österberg M.,Green Chemistry,2020,10.1039/d0gc00096e,287,,,[],,https://api.elsevier.com/content/abstract/scopus_id/85086221042
A review of iot sensing applications and challenges using RFID and wireless sensor networks,Landaluce H.,Sensors (Switzerland),2020,10.3390/s20092495,287,,,[],,https://api.elsevier.com/content/abstract/scopus_id/85083969164
"Machine Learning Adoption in Blockchain-Based Smart Applications: The Challenges, and a Way Forward",Tanwar S.,IEEE Access,2020,10.1109/ACCESS.2019.2961372,287,,,[],,https://api.elsevier.com/content/abstract/scopus_id/85077809551
Blockchain Applications for Industry 4.0 and Industrial IoT: A Review,Alladi T.,IEEE Access,2019,10.1109/ACCESS.2019.2956748,287,,,[],,https://api.elsevier.com/content/abstract/scopus_id/85076956829
Electrical stimulation as a novel tool for regulating cell behavior in tissue engineering,Chen C.,Biomaterials Research,2019,10.1186/s40824-019-0176-8,287,,,[],,https://api.elsevier.com/content/abstract/scopus_id/85076230660
Synthesis and characterization of Mono-disperse Carbon Quantum Dots from Fennel Seeds: Photoluminescence analysis using Machine Learning,Dager A.,Scientific Reports,2019,10.1038/s41598-019-50397-5,287,,,[],,https://api.elsevier.com/content/abstract/scopus_id/85072774612
"The impact of institutional quality on economic growth and carbon emissions: Evidence from Indonesia, South Korea and Thailand",Salman M.,Journal of Cleaner Production,2019,10.1016/j.jclepro.2019.118331,287,,,[],,https://api.elsevier.com/content/abstract/scopus_id/85072231629
Polymer Fiber Scaffolds for Bone and Cartilage Tissue Engineering,Zhang Y.,Advanced Functional Materials,2019,10.1002/adfm.201903279,287,,,[],,https://api.elsevier.com/content/abstract/scopus_id/85068699888
Engineering 3D Ion Transport Channels for Flexible MXene Films with Superior Capacitive Performance,Wang Y.,Advanced Functional Materials,2019,10.1002/adfm.201900326,287,,,[],,https://api.elsevier.com/content/abstract/scopus_id/85061432450
Machine learning techniques for breast cancer computer aided diagnosis using different image modalities: A systematic review,Yassin N.I.R.,Computer Methods and Programs in Biomedicine,2018,10.1016/j.cmpb.2017.12.012,287,,,[],,https://api.elsevier.com/content/abstract/scopus_id/85039416241
Personalized federated learning for intelligent IoT applications: A cloud-edge based framework,Wu Q.,IEEE Open Journal of the Computer Society,2020,10.1109/OJCS.2020.2993259,286,,,[],,https://api.elsevier.com/content/abstract/scopus_id/85124327378
Survey on Network Slicing for Internet of Things Realization in 5G Networks,Wijethilaka S.,IEEE Communications Surveys and Tutorials,2021,10.1109/COMST.2021.3067807,286,,,[],,https://api.elsevier.com/content/abstract/scopus_id/85103277444
Improving supply chain sustainability in the context of COVID-19 pandemic in an emerging economy: Exploring drivers using an integrated model,Karmaker C.L.,Sustainable Production and Consumption,2021,10.1016/j.spc.2020.09.019,286,,,[],,https://api.elsevier.com/content/abstract/scopus_id/85093669151
Electrical stimulation and piezoelectric biomaterials for bone tissue engineering applications,Khare D.,Biomaterials,2020,10.1016/j.biomaterials.2020.120280,286,,,[],,https://api.elsevier.com/content/abstract/scopus_id/85089434098
"Global epidemiology of coronavirus disease 2019 (COVID-19): disease incidence, daily cumulative index, mortality, and their association with country healthcare resources and economic status",Lai C.C.,International Journal of Antimicrobial Agents,2020,10.1016/j.ijantimicag.2020.105946,286,,,[],,https://api.elsevier.com/content/abstract/scopus_id/85082511011
Contributions and risks of artificial intelligence (AI) in building smarter cities: Insights from a systematic review of the literature,Yigitcanlar T.,Energies,2020,10.3390/en13061473,286,,,[],,https://api.elsevier.com/content/abstract/scopus_id/85082506668
Robotic fluidic coupling and interrogation of multiple vascularized organ chips,Novak R.,Nature Biomedical Engineering,2020,10.1038/s41551-019-0497-x,286,,,[],,https://api.elsevier.com/content/abstract/scopus_id/85078487513
"Application of artificial intelligence to wastewater treatment: A bibliometric analysis and systematic review of technology, economy, management, and wastewater reuse",Zhao L.,Process Safety and Environmental Protection,2020,10.1016/j.psep.2019.11.014,286,,,[],,https://api.elsevier.com/content/abstract/scopus_id/85075511697
Digitalisation and intelligent robotics in value chain of circular economy oriented waste management – A review,Sarc R.,Waste Management,2019,10.1016/j.wasman.2019.06.035,286,,,[],,https://api.elsevier.com/content/abstract/scopus_id/85068056387
Adsorption as a technology to achieve ultra-low concentrations of phosphate: Research gaps and economic analysis,Kumar P.S.,Water Research X,2019,10.1016/j.wroa.2019.100029,286,,,[],,https://api.elsevier.com/content/abstract/scopus_id/85065142147
"Energy consumption, economic growth and environmental degradation in OECD countries",Ozcan B.,Economic Modelling,2020,10.1016/j.econmod.2019.04.010,286,,,[],,https://api.elsevier.com/content/abstract/scopus_id/85064618547
Privacy-Preserving Machine Learning: Threats and Solutions,Al-Rubaie M.,IEEE Security and Privacy,2019,10.1109/MSEC.2018.2888775,286,,,[],,https://api.elsevier.com/content/abstract/scopus_id/85063896044
Lightweight Classification of IoT Malware Based on Image Recognition,Su J.,Proceedings - International Computer Software and Applications Conference,2018,10.1109/COMPSAC.2018.10315,286,,,[],,https://api.elsevier.com/content/abstract/scopus_id/85055577661
A multi-cellular 3D bioprinting approach for vascularized heart tissue engineering based on HUVECs and iPSC-derived cardiomyocytes,Maiullari F.,Scientific Reports,2018,10.1038/s41598-018-31848-x,286,,,[],,https://api.elsevier.com/content/abstract/scopus_id/85053219620
Conv-RAM: An energy-efficient SRAM with embedded convolution computation for low-power CNN-based machine learning applications,Biswas A.,Digest of Technical Papers - IEEE International Solid-State Circuits Conference,2018,10.1109/ISSCC.2018.8310397,286,,,[],,https://api.elsevier.com/content/abstract/scopus_id/85046491162
Design and application of internet of things-based warehouse management system for smart logistics,Lee C.,International Journal of Production Research,2018,10.1080/00207543.2017.1394592,286,,,[],,https://api.elsevier.com/content/abstract/scopus_id/85032352517
Machine learning: Overview of the recent progresses and implications for the process systems engineering field,Lee J.H.,Computers and Chemical Engineering,2018,10.1016/j.compchemeng.2017.10.008,286,,,[],,https://api.elsevier.com/content/abstract/scopus_id/85031732831
Digital transformation and environmental sustainability: A review and research agenda,Feroz A.K.,Sustainability (Switzerland),2021,10.3390/su13031530,285,,,[],,https://api.elsevier.com/content/abstract/scopus_id/85100446451
The Feeling Economy: Managing in the Next Generation of Artificial Intelligence (AI),Huang M.H.,California Management Review,2019,10.1177/0008125619863436,285,,,[],,https://api.elsevier.com/content/abstract/scopus_id/85070285869
Advancements in the treatment and processing of electronic waste with sustainability: A review of metal extraction and recovery technologies,Hsu E.,Green Chemistry,2019,10.1039/c8gc03688h,285,,,[],,https://api.elsevier.com/content/abstract/scopus_id/85062513040
Boosting the efficiency of carbon-based planar CsPbBr<inf>3</inf> perovskite solar cells by a modified multistep spin-coating technique and interface engineering,Liu X.,Nano Energy,2019,10.1016/j.nanoen.2018.11.053,285,,,[],,https://api.elsevier.com/content/abstract/scopus_id/85057118880
Chameleon: A hybrid secure computation framework for machine learning applications,Sadegh Riazi M.,ASIACCS 2018 - Proceedings of the 2018 ACM Asia Conference on Computer and Communications Security,2018,10.1145/3196494.3196522,285,,,[],,https://api.elsevier.com/content/abstract/scopus_id/85049164871
Lightweight and Privacy-Preserving Two-Factor Authentication Scheme for IoT Devices,Gope P.,IEEE Internet of Things Journal,2019,10.1109/JIOT.2018.2846299,285,,,[],,https://api.elsevier.com/content/abstract/scopus_id/85048554594
A 65nm 1Mb nonvolatile computing-in-memory ReRAM macro with sub-16ns multiply-and-accumulate for binary DNN AI edge processors,Chen W.,Digest of Technical Papers - IEEE International Solid-State Circuits Conference,2018,10.1109/ISSCC.2018.8310400,285,,,[],,https://api.elsevier.com/content/abstract/scopus_id/85046457848
Water quality prediction using machine learning methods,Haghiabi A.H.,Water Quality Research Journal,2018,10.2166/wqrj.2018.025,285,,,[],,https://api.elsevier.com/content/abstract/scopus_id/85042769782
4D Printed Actuators with Soft-Robotic Functions,López-Valdeolivas M.,Macromolecular Rapid Communications,2018,10.1002/marc.201700710,285,,,[],,https://api.elsevier.com/content/abstract/scopus_id/85037627407
"Review on Nanoparticles and Nanostructured Materials: Bioimaging, Biosensing, Drug Delivery, Tissue Engineering, Antimicrobial, and Agro-Food Applications",Harish V.,Nanomaterials,2022,10.3390/nano12030457,284,,,[],,https://api.elsevier.com/content/abstract/scopus_id/85123516880
Determinants of carbon emissions in Argentina: The roles of renewable energy consumption and globalization,Yuping L.,Energy Reports,2021,10.1016/j.egyr.2021.07.065,284,,,[],,https://api.elsevier.com/content/abstract/scopus_id/85111930961
A rigorous and robust quantum speed-up in supervised machine learning,Liu Y.,Nature Physics,2021,10.1038/s41567-021-01287-z,284,,,[],,https://api.elsevier.com/content/abstract/scopus_id/85109799244
What Role Does Hydrological Science Play in the Age of Machine Learning?,Nearing G.S.,Water Resources Research,2021,10.1029/2020WR028091,284,,,[],,https://api.elsevier.com/content/abstract/scopus_id/85103162633
On the interpretability of artificial intelligence in radiology: Challenges and opportunities,Reyes M.,Radiology: Artificial Intelligence,2020,10.1148/ryai.2020190043,284,,,[],,https://api.elsevier.com/content/abstract/scopus_id/85093675549
How COVID-19 drives connectedness among commodity and financial markets: Evidence from TVP-VAR and causality-in-quantiles techniques,Adekoya O.B.,Resources Policy,2021,10.1016/j.resourpol.2020.101898,284,,,[],,https://api.elsevier.com/content/abstract/scopus_id/85092940748
Efficient machine learning models for prediction of concrete strengths,Nguyen H.,Construction and Building Materials,2021,10.1016/j.conbuildmat.2020.120950,284,,,[],,https://api.elsevier.com/content/abstract/scopus_id/85092744807
Coordination engineering of iridium nanocluster bifunctional electrocatalyst for highly efficient and pH-universal overall water splitting,Wang Q.,Nature Communications,2020,10.1038/s41467-020-18064-w,284,,,[],,https://api.elsevier.com/content/abstract/scopus_id/85089770953
Review of online food delivery platforms and their impacts on sustainability,Li C.,Sustainability (Switzerland),2020,10.3390/su12145528,284,,,[],,https://api.elsevier.com/content/abstract/scopus_id/85088641289
Microbial biofertilizers: Bioresources and eco-friendly technologies for agricultural and environmental sustainability,Kour D.,Biocatalysis and Agricultural Biotechnology,2020,10.1016/j.bcab.2019.101487,284,,,[],,https://api.elsevier.com/content/abstract/scopus_id/85077653987
"Review on transesterification of non-edible sources for biodiesel production with a focus on economic aspects, fuel properties and by-product applications",Rezania S.,Energy Conversion and Management,2019,10.1016/j.enconman.2019.112155,284,,,[],,https://api.elsevier.com/content/abstract/scopus_id/85073676678
Patient clustering improves efficiency of federated machine learning to predict mortality and hospital stay time using distributed electronic medical records,Huang L.,Journal of Biomedical Informatics,2019,10.1016/j.jbi.2019.103291,284,,,[],,https://api.elsevier.com/content/abstract/scopus_id/85073123575
Reducing carbon emissions: The role of renewable energy and democracy,Adams S.,Journal of Cleaner Production,2019,10.1016/j.jclepro.2019.118245,284,,,[],,https://api.elsevier.com/content/abstract/scopus_id/85071720118
Hyperparameter tuning and performance assessment of statistical and machine-learning algorithms using spatial data,Schratz P.,Ecological Modelling,2019,10.1016/j.ecolmodel.2019.06.002,284,,,[],,https://api.elsevier.com/content/abstract/scopus_id/85067413523
The role of big data analytics in industrial Internet of Things,ur Rehman M.H.,Future Generation Computer Systems,2019,10.1016/j.future.2019.04.020,284,,,[],,https://api.elsevier.com/content/abstract/scopus_id/85065055289
Dynamic Task Offloading and Scheduling for Low-Latency IoT Services in Multi-Access Edge Computing,Alameddine H.A.,IEEE Journal on Selected Areas in Communications,2019,10.1109/JSAC.2019.2894306,284,,,[],,https://api.elsevier.com/content/abstract/scopus_id/85061303859
Industry 4.0 and supply chain sustainability: framework and future research directions,Bag S.,Benchmarking,2018,10.1108/BIJ-03-2018-0056,284,,,[],,https://api.elsevier.com/content/abstract/scopus_id/85058951340
From hype to reality: Data science enabling personalized medicine,Fröhlich H.,BMC Medicine,2018,10.1186/s12916-018-1122-7,284,,,[],,https://api.elsevier.com/content/abstract/scopus_id/85052330915
Privacy-preserving smart IoT-based healthcare big data storage and self-adaptive access control system,Yang Y.,Information Sciences,2019,10.1016/j.ins.2018.02.005,284,,,[],,https://api.elsevier.com/content/abstract/scopus_id/85041949735
Electrolyte additive engineering for aqueous Zn ion batteries,Geng Y.,Energy Storage Materials,2022,10.1016/j.ensm.2022.07.017,283,,,[],,https://api.elsevier.com/content/abstract/scopus_id/85134429614
Towards leveraging the role of machine learning and artificial intelligence in precision agriculture and smart farming,Ayoub Shaikh T.,Computers and Electronics in Agriculture,2022,10.1016/j.compag.2022.107119,283,,,[],,https://api.elsevier.com/content/abstract/scopus_id/85134082598
"Direct air capture: process technology, techno-economic and socio-political challenges",Erans M.,Energy and Environmental Science,2022,10.1039/d1ee03523a,283,,,[],,https://api.elsevier.com/content/abstract/scopus_id/85128553166
"Sustainable development of renewable energy integrated power sector: Trends, environmental impacts, and recent challenges",Al-Shetwi A.Q.,Science of the Total Environment,2022,10.1016/j.scitotenv.2022.153645,283,,,[],,https://api.elsevier.com/content/abstract/scopus_id/85124211734
"Internet of Things (IoT): A Review of Its Enabling Technologies in Healthcare Applications, Standards Protocols, Security, and Market Opportunities",Bhuiyan M.N.,IEEE Internet of Things Journal,2021,10.1109/JIOT.2021.3062630,283,,,[],,https://api.elsevier.com/content/abstract/scopus_id/85102252412
Economic development and converging household carbon footprints in China,Mi Z.,Nature Sustainability,2020,10.1038/s41893-020-0504-y,283,,,[],,https://api.elsevier.com/content/abstract/scopus_id/85083051781
"Unsupervised Machine Learning for Networking: Techniques, Applications and Research Challenges",Usama M.,IEEE Access,2019,10.1109/ACCESS.2019.2916648,283,,,[],,https://api.elsevier.com/content/abstract/scopus_id/85067049421
A techno-economic review of silicon photovoltaic module recycling,Deng R.,Renewable and Sustainable Energy Reviews,2019,10.1016/j.rser.2019.04.020,283,,,[],,https://api.elsevier.com/content/abstract/scopus_id/85064680484
Machine learning methods for crop yield prediction and climate change impact assessment in agriculture,Crane-Droesch A.,Environmental Research Letters,2018,10.1088/1748-9326/aae159,283,,,[],,https://api.elsevier.com/content/abstract/scopus_id/85056865972
Transparency and sustainability in global commodity supply chains,Gardner T.A.,World Development,2019,10.1016/j.worlddev.2018.05.025,283,,,[],,https://api.elsevier.com/content/abstract/scopus_id/85047747121
Mobile-Edge Computation Offloading for Ultradense IoT Networks,Guo H.,IEEE Internet of Things Journal,2018,10.1109/JIOT.2018.2838584,283,,,[],,https://api.elsevier.com/content/abstract/scopus_id/85047182823
Integrating Renewable Energy Resources into the Smart Grid: Recent Developments in Information and Communication Technologies,Rehmani M.H.,IEEE Transactions on Industrial Informatics,2018,10.1109/TII.2018.2819169,283,,,[],,https://api.elsevier.com/content/abstract/scopus_id/85044355192
The core components of education 4.0 in higher education: Three case studies in engineering education,Miranda J.,Computers and Electrical Engineering,2021,10.1016/j.compeleceng.2021.107278,282,,,[],,https://api.elsevier.com/content/abstract/scopus_id/85108602900
Urban water resource management for sustainable environment planning using artificial intelligence techniques,Xiang X.,Environmental Impact Assessment Review,2021,10.1016/j.eiar.2020.106515,282,,,[],,https://api.elsevier.com/content/abstract/scopus_id/85096188102
"Investigating the nexus between economic complexity, energy consumption and ecological footprint for the United States: New insights from quantile methods",Shahzad U.,Journal of Cleaner Production,2021,10.1016/j.jclepro.2020.123806,282,,,[],,https://api.elsevier.com/content/abstract/scopus_id/85089937413
The narrative of sustainability and circular economy - A longitudinal review of two decades of research,Schöggl J.P.,"Resources, Conservation and Recycling",2020,10.1016/j.resconrec.2020.105073,282,,,[],,https://api.elsevier.com/content/abstract/scopus_id/85089385188
"Machine learning in python: Main developments and technology trends in data science, machine learning, and artificial intelligence",Raschka S.,Information (Switzerland),2020,10.3390/info11040193,282,,,[],,https://api.elsevier.com/content/abstract/scopus_id/85084748679
Quantum Chemistry in the Age of Machine Learning,Dral P.O.,Journal of Physical Chemistry Letters,2020,10.1021/acs.jpclett.9b03664,282,,,[],,https://api.elsevier.com/content/abstract/scopus_id/85081686900
"Security and Privacy for Green IoT-Based Agriculture: Review, Blockchain Solutions, and Challenges",Ferrag M.A.,IEEE Access,2020,10.1109/ACCESS.2020.2973178,282,,,[],,https://api.elsevier.com/content/abstract/scopus_id/85081112914
Digital transformation and the new logics of business process management,Baiyere A.,European Journal of Information Systems,2020,10.1080/0960085X.2020.1718007,282,,,[],,https://api.elsevier.com/content/abstract/scopus_id/85081004870
"Real-time artificial intelligence for detection of upper gastrointestinal cancer by endoscopy: a multicentre, case-control, diagnostic study",Luo H.,The Lancet Oncology,2019,10.1016/S1470-2045(19)30637-0,282,,,[],,https://api.elsevier.com/content/abstract/scopus_id/85075684957
